{
  "schema_version": "inlumen.pipeline-run@1",
  "run_id": "run-01HZY7PNQ8M1K3A2V9D4C6B5F0",
  "status": "running",
  "engine": "dagster",
  "execution_mode": "background",
  "snapshot": {
    "snapshot_id": "sha256:927e2e8a71f050d04b370616f5a7d70045f7f6d70d351b512ff308f72f85c516",
    "graph_sha256": "sha256:927e2e8a71f050d04b370616f5a7d70045f7f6d70d351b512ff308f72f85c516",
    "bundle_sha256": "sha256:36d96f9289889f22fd01cbec5a3d14bd7d5804b751b15d06b62b6d9ec68f9f3a",
    "pipeline_id": "pipeline-weather-enrichment",
    "pipeline_version": "2.1.0",
    "active_version_uid": "main",
    "node_count": 3,
    "edge_count": 2
  },
  "created_at": "2026-08-26T12:00:00Z",
  "updated_at": "2026-08-26T12:00:03Z",
  "started_at": "2026-08-26T12:00:02Z",
  "finished_at": null,
  "cancel_requested_at": null,
  "event_cursor": 4,
  "error": null,
  "result": null
}
